evidence_id,scope_type,scope_id,criterion,claim,source_type,source_name,source_url,retrieved_date,evidence_class,sentiment,quote_or_note
vantage-hollywood-1710-n-fuller-ave--ev-3,building,vantage-hollywood-1710-n-fuller-ave,quiet,Apartments.com and related location metrics suggest a mixed noise profile rather than a clearly quiet one.,review,Apartments.com listing and Sound Score,https://www.apartments.com/vantage-hollywood-los-angeles-ca/x94e5mp/,2026-04-05,corroborated,mixed,"Apartments.com shows a SoundScore of 70 out of 100 with traffic marked busy, even while the building benefits from a side-street location near Runyon Canyon."
vantage-hollywood-1710-n-fuller-ave--ev-4,building,vantage-hollywood-1710-n-fuller-ave,management,The official resident-testimonial feed is strongly positive about the current team and maintenance response.,official,Equity Apartments testimonials page,https://www.equityapartments.com/los-angeles/west-hollywood/vantage-apartments-reviews,2026-04-05,confirmed,positive,"The current testimonials page reports 3.9 out of 5 based on resident testimonials, with multiple 2025 comments praising Rory, Suzanne, and the maintenance team."
vantage-hollywood-1710-n-fuller-ave--ev-5,building,vantage-hollywood-1710-n-fuller-ave,management,Independent public-review rollups are meaningfully weaker than the official testimonials and point to a more mixed operating picture.,review,Yably and MapQuest review rollups,https://yably.com/reviews/los-angeles/vantage-hollywood-apartments-1710-n-fuller-ave,2026-04-05,corroborated,mixed,"Yably aggregates a 4.20 Google score, a 2.75 Zillow score, and a 3.90 Equity score, while recent MapQuest-surfaced Yelp snippets include praise for the staff alongside complaints about hot water, garage conditions, and missed leasing-office coverage."
vantage-hollywood-1710-n-fuller-ave--ev-6,building,vantage-hollywood-1710-n-fuller-ave,community_stability,"The address is actively marketed through third-party furnished-housing channels with flexible lease lengths, which raises a real community-stability question.",review,Apartments.com furnished unit listing at 1710 N Fuller Ave,https://www.apartments.com/1710-n-fuller-ave-los-angeles-ca/zfdvtsz/,2026-04-05,inferred,mixed,"A furnished unit at the same address is marketed with 1 to 12 month lease options, which suggests at least some flexible-stay activity beyond a standard long-term lease pattern."
modera_hollywood--ev-1,building,modera_hollywood,amenities,"Current official materials confirm an unusually deep amenity package, including rooftop decks, pool lounges, coworking and conference rooms, a recording studio, pet facilities, Amazon lockers, controlled parking, and in-home washers and dryers.",official,Modera Hollywood amenities page,https://www.moderahollywood.com/los-angeles/modera-hollywood/amenities/,2026-04-05,confirmed,positive,"The current amenities page lists resort-style pools, rooftop lounges, conference rooms, a recording studio, Amazon package lockers, controlled access parking garage, and front-loading washers and dryers."
modera_hollywood--ev-2,building,modera_hollywood,security,"The current FAQ page adds useful operating detail on package handling, courtesy patrol, EV charging, coworking hours, and in-home appliance standards.",official,Modera Hollywood FAQ,https://www.moderahollywood.com/los-angeles-ca-apartments/modera-hollywood/faqs/,2026-04-05,confirmed,positive,"The FAQ says packages go to Amazon HUB lockers, oversized packages are held at the leasing office or delivered to the door, courtesy patrol is offered, the fitness center is 24 hours, and EV charging is available for $175 per month."
modera_hollywood--ev-3,building,modera_hollywood,management,Official resident reviews are strongly positive and suggest a stable on-site team rather than a chaotic lease-up operation.,official,Modera Hollywood ratings and reviews page,https://www.moderahollywood.com/los-angeles-ca-apartments/modera-hollywood/prospect-ratings-and-reviews/,2026-04-05,confirmed,positive,"The current review page shows 5 out of 5 across 45 reviews with 93.3 percent recommending the property, including a February 2025 response noting a resident had already been there for over two years."
modera_hollywood--ev-4,building,modera_hollywood,management,Independent listing sources also show a favorable review picture and a mature amenity and maintenance profile for a 2019 building.,review,Apartments.com listing,https://www.apartments.com/modera-hollywood-los-angeles-ca/zmm3ydz/,2026-04-05,corroborated,positive,"Apartments.com shows a 4.9 blended score across 38 reviews and lists package service, maintenance on site, property manager on site, conference rooms, and a 2019 build year."
modera_hollywood--ev-5,building,modera_hollywood,location_fit,"The building is operationally strong, but the quiet profile remains imperfect because the property openly markets nightlife adjacency and now has active ground-floor retail at the same address.",news,Patch coverage of Panera opening at 6775 Selma Ave,https://patch.com/california/hollywood/panera-opens-hollywood-location-2nd-central-los-angeles,2026-04-05,confirmed,mixed,"Patch reported that a Panera To Go location opened at 6775 Selma Ave in March 2025, a pickup and delivery oriented format that adds real ground-floor activity at the building address."
modera_hollywood--ev-6,building,modera_hollywood,pricing_transparency,"Current pricing is reasonably transparent, but concession messaging is not perfectly clean across sources.",official,Zillow building page and official home page,https://www.zillow.com/apartments/los-angeles-ca/modera-hollywood/CkBBLy/,2026-04-05,corroborated,mixed,"Zillow currently shows 1 bedrooms starting around $2,614 and says price may not include required fees and charges, while the current official home page advertises up to 4 weeks free plus $1,000 off and older Zillow capture text referenced a lease-by March 31 deadline."
modera_hollywood--ev-7,building,modera_hollywood,management,"Visible independent review snippets are still positive overall, but they are not so clean that management confidence should be pushed to high.",review,MapQuest review rollup from Yelp,https://www.mapquest.com/us/california/modera-hollywood-424527074,2026-04-05,anecdotal,positive,"MapQuest shows a 3.5 rating across 42 reviews with recent snippets praising move-in support, views, and touring experience, which is good but not as overwhelming as the official review feed."
argyle_house--ev-1,building,argyle_house,amenities,"Current official materials support a high-service amenity stack with a 24/7 attended lobby, pool and spa, conference rooms, entertainment lounge, and in-home laundry.",official,Related Rentals Argyle House page,https://www.relatedrentals.com/apartment-rentals/los-angeles/hollywood/argyle-house,2026-04-05,confirmed,positive,"The current Related page lists a 24/7 attended lobby, conference rooms, pool and spa, entertainment lounge, library lounge, washer and dryer, package program, and Life Simplified in-home task service."
argyle_house--ev-2,building,argyle_house,community_stability,"Related California describes Argyle House as a 114-unit, 18-story, LEED Silver tower with an attended lobby and resident-focused amenity program, which supports a more stable residential operating model than a hotel-like one.",official,Related California property page,https://www.relatedcalifornia.com/our-company/properties/argyle-house,2026-04-05,confirmed,positive,"The property page describes a completed 2018 tower with an attended lobby, fitness center, library lounge, pool, spa, and barbecue area."
argyle_house--ev-3,building,argyle_house,pricing_transparency,"Current live inventory is reasonably transparent, but it is also limited and currently studio-heavy.",official,Zillow building page,https://www.zillow.com/apartments/los-angeles-ca/argyle-house/B6mzSx/,2026-04-05,confirmed,mixed,"Zillow currently shows studio inventory starting around $3,195 and notes that displayed pricing may not include required fees and charges."
argyle_house--ev-4,building,argyle_house,quiet,A recent positive Yelp review specifically praises the building for sound insulation despite the Hollywood location.,review,Yelp review snippet surfaced in search results,https://www.yelp.ca/biz/argyle-house-los-angeles-3,2026-04-05,anecdotal,positive,"A November 2024 reviewer said the windows, walls, and floors were soundproof enough that they never heard neighbors or Hollywood nightlife."
argyle_house--ev-5,building,argyle_house,management,"At least one public review alleges severe maintenance and water-intrusion issues, delayed repairs, and unauthorized entry during an emergency response, which keeps management confidence below high.",review,Yelp review snippet surfaced in search results,https://www.yelp.ca/biz/argyle-house-los-angeles-3,2026-04-05,anecdotal,negative,"A critical review describes repeated delay around a leaking sliding door, electrical-fire risk from water intrusion, and maintenance entering the unit without warning during a leak event."
argyle_house--ev-6,building,argyle_house,management,"The broad public review corpus is not deep enough to settle the conflict cleanly, which is why management and quiet stay at medium confidence rather than high.",review,Apartments.com listing,https://www.apartments.com/argyle-house-los-angeles-ca/8ybehn2/,2026-04-05,inferred,neutral,"Apartments.com currently shows a strong building rating but no renter reviews yet, so the accessible independent evidence remains thinner than the official service narrative."
smb_hollywood--ev-1,building,smb_hollywood,amenities,"Current official materials support a very strong amenity and operations package that includes 24/7 front desk staff, secure underground parking, package room, coworking space, pool and spa, sauna and steam, and maintenance on site.",official,SMB Hollywood amenities page,https://www.smbhollywood.com/amenities,2026-04-05,confirmed,positive,"The current amenities page lists 24/7 front desk staff, secure underground parking, package room, courtesy patrol, maintenance on site, EV charging, coworking with private phone rooms, and pool, spa, sauna, and steam room amenities."
smb_hollywood--ev-2,building,smb_hollywood,pricing_transparency,"The official website contains obvious stale content, which lowers confidence in the leasing presentation even though the core amenity facts appear plausible.",official,SMB Hollywood amenities page,https://www.smbhollywood.com/amenities,2026-04-05,confirmed,negative,"The same page suddenly switches into Chicago language such as ""Live on a Higher Rental Frequency in Chicago"" and references Chicago skyline style copy, showing that the marketing content was not fully cleaned up."
smb_hollywood--ev-3,building,smb_hollywood,pricing_transparency,Current listing feeds show in-range studio and 1 bedroom availability but also warn that displayed pricing may exclude fees or other required charges.,official,Zillow and Apartments.com building pages,https://www.zillow.com/apartments/los-angeles-ca/smb-hollywood/Ch6Dbh/,2026-04-05,corroborated,mixed,"Zillow currently shows studios from $2,876 and 1 bedrooms from $3,011, while Apartments.com shows the same warning that displayed pricing excludes some required or usage-based charges."
smb_hollywood--ev-4,building,smb_hollywood,management,Independent public review snippets are materially weaker than the listing-platform scores and point to real leasing and management friction.,review,MapQuest review rollup from Yelp,https://www.mapquest.com/us/california/smb-hollywood-by-onni-516541023,2026-04-05,corroborated,negative,"MapQuest shows a 2.5 rating across 10 reviews, with snippets praising security and front desk staff but criticizing management after move-in, application handling, and general tenant treatment."
smb_hollywood--ev-5,building,smb_hollywood,community_stability,"The address appears in furnished and short-term inventory channels, which raises a meaningful community-stability question.",review,Apartments.com furnished corporate unit listing at 6933 Santa Monica Blvd,https://www.apartments.com/6933-santa-monica-blvd-los-angeles-ca-unit-id407355p/g1px4mx/,2026-04-05,inferred,mixed,"A furnished unit listing at the same address advertises short-term lease options, furnished units, and a home-plus-hotel-service framing, which is not ideal for a stable residential environment."
smb_hollywood--ev-6,building,smb_hollywood,quiet,The location profile is inherently noisy for a quiet-first search because the building sits directly on Santa Monica Boulevard and markets itself around being at the center of Hollywood activity.,official,SMB Hollywood home page,https://www.smbhollywood.com/,2026-04-05,confirmed,mixed,"The current home page describes the property as being at the gateway to West Hollywood, steps from restaurants, shopping, and galleries, with a Santa Monica Boulevard address."
smb_hollywood--ev-7,building,smb_hollywood,management,"Listing platforms present a more favorable picture than the harshest independent snippets, which means the building is conflicted rather than automatically disqualified.",review,Apartments.com listing,https://www.apartments.com/smb-hollywood-los-angeles-ca/6xk8ebt/,2026-04-05,corroborated,mixed,"Apartments.com shows a 4.9 blended score but only across 4 renter reviews, so it is directionally positive without being strong enough to erase the broader trust concerns."
archer_hollywood--ev-1,building,archer_hollywood,amenities,"Current official materials confirm a very strong amenity package with coworking, conference space, a screening room, two roof decks, pool and spa amenities, parcel lockers, and in-unit washers and dryers.",official,Archer Hollywood amenities page,https://archerhwood.com/amenities/,2026-04-05,confirmed,positive,"The current amenities page lists a dedicated coworking space with conference room, private screening room with Karaoke, two roof decks, pool deck and spa with cabanas, double-level fitness center, parcel lockers, and in-unit stackable washer and dryer."
archer_hollywood--ev-2,building,archer_hollywood,pricing_transparency,"The official general-information page is more transparent than average on baseline fees and pet terms, but the home page still warns that non-lease amenities, fees, or concessions can change.",official,Archer Hollywood general information and home pages,https://archerhwood.com/general-information/,2026-04-05,corroborated,mixed,"The general-information page lists deposit as 1 month rent, application fee as $58 per adult, max two pets, $50 monthly pet rent, and $500 refundable pet deposit per pet, while the home page says amenities, fees, or concessions not included in the lease agreement are subject to change without notice."
archer_hollywood--ev-3,building,archer_hollywood,quiet,"Official location marketing explicitly centers Hollywood Boulevard nightlife and immediate bar and restaurant adjacency, which is a real everyday noise risk for this search.",official,Archer Hollywood neighborhood page,https://archerhwood.com/neighborhood/,2026-04-05,confirmed,negative,"The neighborhood page says the property sits at the intersection of Hollywood Blvd and N. Las Palmas, that the lifestyle is literally just outside your door, and that famed bars and restaurants are steps away with nightlife awakening when the sun sets on Hollywood Blvd."
archer_hollywood--ev-4,building,archer_hollywood,community_stability,Current listing feeds corroborate a busy living environment with short-term lease options rather than a purely conventional long-term residential profile.,official,Apartments.com listing,https://www.apartments.com/archer-hollywood-los-angeles-ca/zrmncdx/,2026-04-05,corroborated,mixed,"Apartments.com currently shows 13 to 15 month leases, short-term lease availability, property manager on site, maintenance on site, and a Busy sound profile with traffic and businesses marked busy."
archer_hollywood--ev-5,building,archer_hollywood,quiet,"Public-record and local-logic signals point to a noisy, active area and confirm the building is a 2021 six-story mixed-use project over three basement levels.",public_record,Redfin public record and Local Logic profile,https://www.redfin.com/CA/Los-Angeles/1718-N-Las-Palmas-Ave-90028/home/167572236,2026-04-05,corroborated,negative,"Redfin shows a Jan. 2021 permit for a new six-story mixed-use building over three basement levels and current Local Logic scores of 2.8 out of 10 for noisy area and 6.6 out of 10 for quite busy, along with later EV charger permits."
archer_hollywood--ev-6,building,archer_hollywood,security,"At least some resident feedback is strongly positive on security presence, parking, cleanliness, and maintenance responsiveness, which prevents an automatic worst-case reading.",review,Chamber of Commerce review rollup,https://www.chamberofcommerce.com/united-states/california/los-angeles/apartment-building/2023045264-archer-hollywood,2026-04-05,anecdotal,positive,"The Chamber page shows a 3.7 rating across 43 reviews and includes a resident review praising security guards, cleaning staff, rooftop areas, pool, theater, work rooms, underground parking, and management communication."
archer_hollywood--ev-7,building,archer_hollywood,management,"Recent review snippets describe maintenance frustration, hot-water and heater problems, and a lease-term surprise, which materially lowers management confidence even after accounting for the positive reviews.",review,MapQuest review rollup from Yelp,https://www.mapquest.com/us/california/archer-hollywood-521717383,2026-04-05,corroborated,negative,"Recent snippets include a Dec. 2025 complaint about new management and long-running lack of warm water, a Mar. 2025 complaint about a 12 month lease changing to 13 months, a Mar. 2025 complaint about no working heater, and a June 2024 complaint about leasing follow-up and call-center confusion."
