evidence_id,scope_type,scope_id,criterion,claim,source_type,source_name,source_url,retrieved_date,evidence_class,sentiment,quote_or_note
lumina-hollywood-1522-gordon-st--ev-5,building,lumina-hollywood-1522-gordon-st,pricing_transparency,"Live availability is visible, but pricing is not fully self-contained because current listing pages warn that required fees may be excluded and the site references a fee guide without exposing the full breakdown in accessible page text.",official,Zillow Lumina Hollywood listing and official floorplans flow,https://www.zillow.com/apartments/hollywood-ca/lumina-hollywood/CkCM7b/,2026-04-05,corroborated,mixed,"Zillow shows current units and warns that price may not include required fees and charges. The official leasing flow references a community fee guide, but the full fee schedule was not exposed in the accessible page content."
lumina-hollywood-1522-gordon-st--ev-6,building,lumina-hollywood-1522-gordon-st,security,"Security confidence should stay moderate, not high, because the building has controlled access and concierge coverage but also had a serious resident threat incident reported in 2023.",news,Los Angeles Times report on 2023 Lumina incident,https://www.latimes.com/california/story/2023-02-02/man-aimed-loaded-rifles-from-hollywood-high-rise,2026-04-05,confirmed,negative,"The Times reported that residents and security staff at Lumina alerted police after a resident made threats and police recovered multiple loaded weapons from an 18th-floor apartment. This is stale enough not to be a current hard stop, but it is relevant context."
silhouette-apartments-1233-n-highland-ave--ev-1,building,silhouette-apartments-1233-n-highland-ave,amenities,"Current official materials confirm a strong amenity stack centered on fitness, work, and outdoor common space, including rooftop lounges, courtyards with fire pits, meeting rooms, and ground-floor retail.",official,Silhouette amenities page,https://silhouettela.com/amenities/,2026-04-05,confirmed,positive,"The current amenities page describes two stories of amenities with recreation rooms, full kitchens, meeting rooms, business centers, rooftop lounges, courtyards, and ground-floor retail."
silhouette-apartments-1233-n-highland-ave--ev-2,building,silhouette-apartments-1233-n-highland-ave,management,"Current listing sources clearly attach Greystar to the property and show maintenance on site, package service, controlled access, key fob entry, and EV charging.",official,Apartments.com and Greystar property pages,https://www.apartments.com/silhouette-apartments-los-angeles-ca/7h539fy/,2026-04-05,corroborated,positive,"Apartments.com lists package service, controlled access, maintenance on site, EV charging, and key fob entry, while the Greystar page gives current pricing disclosures and contact information."
silhouette-apartments-1233-n-highland-ave--ev-3,building,silhouette-apartments-1233-n-highland-ave,pricing_transparency,Pricing transparency is better than average because current Zillow pages show total monthly price and disclose several required charges in plain language.,official,Zillow Silhouette Apartments listing,https://www.zillow.com/apartments/los-angeles-ca/silhouette-apartments/CjHsns/,2026-04-05,confirmed,positive,"Zillow says the listing now includes required monthly fees in the total monthly price and separately discloses the application fee, holding deposit, security deposit range, pest control, SCEP fee, billing admin fee, and usage-based utilities."
silhouette-apartments-1233-n-highland-ave--ev-4,building,silhouette-apartments-1233-n-highland-ave,quiet,"Quiet risk is still only moderate because the building is marketed as being in the heart of Hollywood and includes ground-floor retail, which creates more activity exposure than quieter side-street options.",official,Silhouette homepage and location page,https://silhouettela.com/,2026-04-05,corroborated,mixed,"The homepage calls it luxury apartment living in the heart of Hollywood, and the location page emphasizes direct access to a dynamic neighborhood with entertainment and dining right outside the door."
silhouette-apartments-1233-n-highland-ave--ev-5,building,silhouette-apartments-1233-n-highland-ave,community_stability,Community-stability confidence should remain low because the building is newly delivered and the public renter-review corpus is still too thin to show clear long-term operating patterns.,review,Apartments.com and Apartment Finder,https://www.apartments.com/silhouette-apartments-los-angeles-ca/7h539fy/,2026-04-05,inferred,neutral,"Apartments.com shows a 5.0 blended rating from only 2 reviews, and Apartment Finder says the community was built in 2025, so the lived-experience record is still shallow."
silhouette-apartments-1233-n-highland-ave--ev-6,building,silhouette-apartments-1233-n-highland-ave,management,There is a small but notable polish concern on the public site because the retail page still contains placeholder text and dummy contact fields.,official,Silhouette retail page,https://silhouettela.com/retail/,2026-04-05,confirmed,mixed,"The retail page still shows placeholder text like JOHN DOE and sample call-to-action copy, which is minor but not a great operations-polish signal for a new lease-up."
aka-8500-sunset-8500-sunset-blvd--ev-1,building,aka-8500-sunset-8500-sunset-blvd,management,Current official marketing confirms a full-service operating model with a 24-hour on-site team and a luxury residential positioning rather than a standard lease-up structure.,official,8500 Sunset official apartments site,https://www.8500sunsetapartments.com/,2026-04-05,confirmed,positive,"The official site highlights the outdoor lounge and pool deck, high-tech fitness center, private cinema, and a current service-oriented leasing flow with direct video-call scheduling and a resident-services tone."
aka-8500-sunset-8500-sunset-blvd--ev-2,building,aka-8500-sunset-8500-sunset-blvd,management,"Large-listing coverage corroborates the staffing and service case by advertising a 24 hour on-site team, 24 hour service, night patrol, and a doorman or door-attendant style setup.",review,Apartments.com AKA West Hollywood listing,https://www.apartments.com/aka-west-hollywood-apartment-residences-west-hollywood-ca/x4brlmm/,2026-04-05,corroborated,positive,"Apartments.com describes a 24 hour on site team and lists 24 Hour Service, Night Patrol, and door-attendant style security features."
aka-8500-sunset-8500-sunset-blvd--ev-3,building,aka-8500-sunset-8500-sunset-blvd,community_stability,Community-stability risk is high enough to matter because the property explicitly offers weekly and monthly furnished and serviced stays in addition to annual leasing.,official,8500 Sunset official site and Apartments.com,https://www.8500sunsetapartments.com/,2026-04-05,corroborated,mixed,"The official site says the apartments are available for annual leasing, while large-listing sources add that luxury furnished and serviced residences are available for weekly and monthly stays."
aka-8500-sunset-8500-sunset-blvd--ev-4,building,aka-8500-sunset-8500-sunset-blvd,quiet,"Quiet risk is inherently elevated because the building sits directly on the Sunset Strip and shares its address with active retail, dining, and fitness uses.",official,8500 Sunset official site and Zillow,https://www.zillow.com/apartments/west-hollywood-ca/aka-west-hollywood-apartment-residences/CgsXn3/,2026-04-05,corroborated,negative,"Current pages repeatedly describe the property as being on the iconic Sunset Strip and sharing the address with retail, restaurant, and boxing uses, which is structurally bad for a quiet-first default assumption."
aka-8500-sunset-8500-sunset-blvd--ev-5,building,aka-8500-sunset-8500-sunset-blvd,pricing_transparency,"Current live pricing is visible, but the cost picture remains only moderately transparent because required fees may still be excluded from advertised rents and inclusions vary by unit or service level.",official,Zillow AKA West Hollywood listing,https://www.zillow.com/apartments/west-hollywood-ca/aka-west-hollywood-apartment-residences/CgsXn3/,2026-04-05,confirmed,mixed,"Zillow shows the current studio at $5,000 and 1 bedrooms from the mid-$5,600s but still warns that price may not include required fees and charges."
aka-8500-sunset-8500-sunset-blvd--ev-6,building,aka-8500-sunset-8500-sunset-blvd,amenities,"Some current unit marketing suggests unusually strong value on service inclusions because parking, utilities, cable, and weekly housekeeping can be included in certain offerings.",review,Apartments.com unit and property pages,https://www.apartments.com/8500-sunset-blvd-west-hollywood-ca-unit-ph801/8pnqzz0/,2026-04-05,corroborated,positive,"Current unit pages mention parking included, 24 hour valet service, house car access, in-room dining, and in some cases all utilities and cable included with housekeeping once per week."
aka-8500-sunset-8500-sunset-blvd--ev-7,building,aka-8500-sunset-8500-sunset-blvd,security,Security should not be assumed perfect because at least one secondary review source reports a valet-theft complaint despite the strong staffing and service model.,review,Top-Rated.Online review mirror,https://www.top-rated.online/cities/West%2BHollywood/place/p/14953291/8500%2BSunset%2B-%2BThe%2BApartment%2BResidences%2Bat%2BAKA,2026-04-05,anecdotal,negative,"A mirrored Google review says to be aware of valet because valuables can be stolen. This is low-trust and not enough to override the broader service case, but it does keep security from scoring as low-risk perfection."
the-avenue-hollywood-1619-n-la-brea-ave--ev-1,building,the-avenue-hollywood-1619-n-la-brea-ave,amenities,"Large-listing sources confirm a strong operational amenity stack including concierge, package service, controlled access, video patrol, maintenance on site, business center, pool, spa, and fitness center.",review,Apartments.com The Avenue Hollywood listing,https://www.apartments.com/the-avenue-hollywood-hollywood-ca/pzblp3t/,2026-04-05,confirmed,positive,"Apartments.com lists package service, controlled access, maintenance on site, property manager on site, concierge, video patrol, 24 hour access, business center, pool, spa, and fitness center."
the-avenue-hollywood-1619-n-la-brea-ave--ev-2,building,the-avenue-hollywood-1619-n-la-brea-ave,management,Management looks stronger than average because Greystar is clearly attached to the asset and the public renter-review signal is both sizable and positive compared with most peers in this search.,review,Apartments.com and official contact pages,https://theavenuehollywood.com/contact/,2026-04-05,corroborated,positive,"The official site shows Greystar leasing contact information, while Apartments.com shows a 4.8 blended score from 25 renter reviews."
the-avenue-hollywood-1619-n-la-brea-ave--ev-3,building,the-avenue-hollywood-1619-n-la-brea-ave,pricing_transparency,Pricing transparency is above average because the official site and Zillow both use total monthly pricing language and point renters to fee disclosures before application.,official,The Avenue residences page and Zillow listing,https://theavenuehollywood.com/residences/,2026-04-05,corroborated,positive,"The official residences page explains Total Monthly Leasing Price and references a fee guide, while Zillow says required monthly fees are included in the current total monthly price view."
the-avenue-hollywood-1619-n-la-brea-ave--ev-4,building,the-avenue-hollywood-1619-n-la-brea-ave,quiet,"The building has a plausible quiet case because official materials specifically advertise condo-quality construction, neighbors-noise privacy, and floor-to-ceiling double-paned windows.",official,The Avenue residences page,https://theavenuehollywood.com/residences/,2026-04-05,confirmed,positive,"The residences page says condo-quality, well-constructed units mean neighbors noise will not spoil privacy and highlights floor-to-ceiling double-paned windows."
the-avenue-hollywood-1619-n-la-brea-ave--ev-5,building,the-avenue-hollywood-1619-n-la-brea-ave,quiet,"Location noise still needs caution because the property sits at a busy Hollywood edge and markets immediate access to nightclubs, studios, dining, and major local activity.",official,The Avenue neighborhood and homepage,https://theavenuehollywood.com/neighborhood/,2026-04-05,corroborated,mixed,"The neighborhood page emphasizes canyon hiking trails and velvet rope nightclubs, while the homepage places the building at the crossroads of La Brea and Hollywood Boulevard."
the-avenue-hollywood-1619-n-la-brea-ave--ev-6,building,the-avenue-hollywood-1619-n-la-brea-ave,community_stability,Community-stability risk is not cleanly residential because current public listings still advertise furnished units and short-term apartment availability.,review,Zillow and Apartments.com,https://www.zillow.com/apartments/los-angeles-ca/the-avenue-hollywood/5XkGLb/,2026-04-05,corroborated,mixed,"Zillow says furnished and short-term apartments are available, and Apartments.com lists furnished units available as a property feature."
the-avenue-hollywood-1619-n-la-brea-ave--ev-7,building,the-avenue-hollywood-1619-n-la-brea-ave,management,"A lower-trust review mirror shows that not all lived-experience feedback is positive, so management should score strong but not flawless.",review,Top-Rated.Online review mirror,https://www.top-rated.online/cities/Los%2BAngeles/place/p/14953343/The%2BAvenue%2BHollywood%2BApartments,2026-04-05,anecdotal,mixed,"The review mirror shows some critical commentary about management and maintenance, but the snippet is lower trust than the current Apartments.com review corpus and not enough to override the broader positive signal."
the-baxter-1818-n-cherokee-ave--ev-1,building,the-baxter-1818-n-cherokee-ave,amenities,"Current listing sources confirm a strong amenity package including a secured parcel room, EV chargers, rooftop deck, social lounge, communal working space, bike storage, and parking.",review,Apartments.com The Baxter listing,https://www.apartments.com/the-baxter-los-angeles-ca/mtsg17j/,2026-04-05,confirmed,positive,"Apartments.com lists secured parcel room, EV chargers, parking, bike storage, rooftop or roof deck, social lounge, outdoor kitchen, communal working space, and online maintenance portal."
the-baxter-1818-n-cherokee-ave--ev-2,building,the-baxter-1818-n-cherokee-ave,amenities,"Zillow corroborates core resident features like in-unit washer and dryer, fitness center, rooftop sun deck, coffee bar, pet play area, and gated covered parking garage.",official,Zillow The Baxter listing,https://www.zillow.com/apartments/los-angeles-ca/the-baxter/9TywSf/,2026-04-05,corroborated,positive,"Zillow describes washer and dryer in unit, fitness center, rooftop sun deck, coffee bar in lobby, pet play area, and gated covered parking garage."
the-baxter-1818-n-cherokee-ave--ev-3,building,the-baxter-1818-n-cherokee-ave,quiet,"The Cherokee location gives the building a better quiet case than many Sunset-fronting competitors, but it is still marketed around immediate access to Hollywood attractions and nightlife-adjacent destinations.",official,The Baxter official site,https://thebaxterhollywood.com/,2026-04-05,inferred,mixed,"The official site centers the location on nearby Walk of Fame, Musso & Frank, TCL Chinese Theatre, and other Hollywood landmarks, which is more active than a calm residential pocket even if Cherokee itself is not the loudest frontage."
the-baxter-1818-n-cherokee-ave--ev-4,building,the-baxter-1818-n-cherokee-ave,community_stability,Community-stability risk is meaningful because the official site has promoted fully furnished units and flexible living rather than a purely conventional annual-lease identity.,official,The Baxter official site,https://www.thebaxterhollywood.com/,2026-04-05,confirmed,mixed,"An official version of the site recently advertised fully furnished units and framed the offering around the art of flexible living, which raises churn and hotel-like-use questions."
the-baxter-1818-n-cherokee-ave--ev-5,building,the-baxter-1818-n-cherokee-ave,management,Management confidence should stay modest because the visible public review base is still small and largely lease-up era rather than a deep body of long-term resident feedback.,review,Chamber of Commerce and RateMyApartments,https://www.chamberofcommerce.com/business-directory/california/los-angeles/apartment-building/2025917238-the-baxter,2026-04-05,inferred,neutral,"The public comments that surface are sparse and mostly positive tour or lease-up impressions, which is encouraging but not enough for high management confidence."
the-baxter-1818-n-cherokee-ave--ev-6,building,the-baxter-1818-n-cherokee-ave,pricing_transparency,"Live prices are visible for current units, but pricing transparency is only moderate because the accessible sources do not expose a clear comprehensive fee guide or full recurring-charge stack.",official,Zillow and official site,https://www.zillow.com/apartments/los-angeles-ca/the-baxter/9TywSf/,2026-04-05,corroborated,mixed,"Zillow shows live rents and unit availability, but the accessible page content does not surface the full recurring fee stack in the same way some Greystar properties now do."
the-charlie-weho-7617-santa-monica-blvd--ev-1,building,the-charlie-weho-7617-santa-monica-blvd,amenities,"Current official pages confirm a strong lifestyle amenity package with coworking, rooftop pool and lounges, courtyards, fitness center, and pet-friendly design.",official,The Charlie WeHo site and amenities page,https://thecharlieweho.com/amenities/,2026-04-05,confirmed,positive,"The amenities page highlights a leasing office and cowork nook, rooftop sanctuary with cabanas and fire pits, courtyards, fitness center, and pet-friendly living."
the-charlie-weho-7617-santa-monica-blvd--ev-2,building,the-charlie-weho-7617-santa-monica-blvd,management,Management looks better than average because current official pages identify Greystar and third-party listings show a relatively healthy early review signal for a 2023 building.,review,"Official site, Apartments.com, and Top-Rated.Online",https://thecharlieweho.com/,2026-04-05,corroborated,positive,"The official site names Greystar, Apartments.com identifies the building as built in 2023, and a Google-review mirror shows roughly a 4.6 rating from 10 reviews."
the-charlie-weho-7617-santa-monica-blvd--ev-3,building,the-charlie-weho-7617-santa-monica-blvd,pricing_transparency,Pricing transparency is stronger than average because Zillow currently surfaces required monthly charges and total monthly pricing rather than only teaser rent.,official,Zillow The Charlie WeHo listing,https://www.zillow.com/apartments/west-hollywood-ca/the-charlie-weho/9MMd65/,2026-04-05,confirmed,positive,"Zillow includes required monthly fees in the total monthly price view and separately lists application fee, holding deposit, security deposit range, municipality fee, pest control, utility-billing admin fee, and other variable utility charges."
the-charlie-weho-7617-santa-monica-blvd--ev-4,building,the-charlie-weho-7617-santa-monica-blvd,quiet,"Default location noise risk is high because the building sits directly on Santa Monica Boulevard and markets itself around bars, restaurants, parks, and the heart-of-everything WeHo location.",official,The Charlie WeHo homepage and Zillow listing,https://thecharlieweho.com/,2026-04-05,corroborated,negative,"The official homepage describes the property as centrally located near West Hollywood’s finest restaurants, bars, parks, and flea markets, and the address is directly on Santa Monica Boulevard."
the-charlie-weho-7617-santa-monica-blvd--ev-5,building,the-charlie-weho-7617-santa-monica-blvd,community_stability,"Community-stability signals are mixed because the site emphasizes a boutique residential culture, but the lobby is explicitly hotel-esque and amenity design is very social rather than purely quiet-residential.",official,The Charlie WeHo official site,https://thecharlieweho.com/,2026-04-05,inferred,mixed,"The site describes the lobby as an open, hotel-esque co-mingling space with coworking and hidden hangouts, which is not automatically a problem but does not read like a quiet, old-school residential building."
the-charlie-weho-7617-santa-monica-blvd--ev-6,building,the-charlie-weho-7617-santa-monica-blvd,security,"Security signals are generally good because current listings show a relatively new 71-unit building with in-unit laundry and structured amenities, but there is not enough direct evidence to score security as exceptionally low-risk.",review,Apartments.com The Charlie WeHo listing,https://www.apartments.com/the-charlie-weho-west-hollywood-ca/clgxc7f/,2026-04-05,inferred,neutral,"Apartments.com confirms a 2023 building with 71 units and structured amenity spaces, but the accessible source set did not surface enough direct package-theft, garage-break-in, or after-hours-control evidence to score higher-confidence security."
the-highland-1411-n-highland-ave--ev-1,building,the-highland-1411-n-highland-ave,amenities,"Current official materials confirm a strong amenity package including EV charging, business center, conference room, dog park, bike storage, and on-site maintenance.",official,The Highland official site,https://www.thehighlandgk.com/,2026-04-05,confirmed,positive,"The current site lists EV charging stations, business center, conference room, on-site maintenance, bike storage, dog park, and washer and dryer in unit."
the-highland-1411-n-highland-ave--ev-2,building,the-highland-1411-n-highland-ave,pricing_transparency,Pricing transparency is stronger than average because Zillow currently shows required monthly charges inside the total monthly price view.,official,Zillow The Highland listing,https://www.zillow.com/apartments/hollywood-ca/the-highland/CkMJKN/,2026-04-05,confirmed,positive,Zillow says the listing now includes required monthly fees in the total monthly price and shows current studios and 1 bedrooms inside your working budget range.
the-highland-1411-n-highland-ave--ev-3,building,the-highland-1411-n-highland-ave,management,Management looks better than average because Greystar is clearly attached and the current public renter-review signal is relatively deep and positive.,review,Apartments.com The Highland listing,https://www.apartments.com/the-highland-hollywood-ca/0pwyef2/,2026-04-05,corroborated,positive,"Apartments.com shows a 4.7 blended score from 21 renter reviews, which is a more meaningful review base than many other candidates."
the-highland-1411-n-highland-ave--ev-4,building,the-highland-1411-n-highland-ave,quiet,Quiet risk is high by default because the building openly markets its rooftop and entertainment-oriented location rather than acoustic retreat or low-activity living.,official,Zillow and official site,https://www.zillow.com/apartments/hollywood-ca/the-highland/CkMJKN/,2026-04-05,corroborated,negative,The listing calls the rooftop Hollywood’s hottest rooftop and emphasizes proximity to entertainment hot spots and the Metro Red Line.
the-highland-1411-n-highland-ave--ev-5,building,the-highland-1411-n-highland-ave,community_stability,"Community-stability signals are mixed because the property appears more like a conventional apartment building than a serviced-stay concept, but the rooftop-centered branding suggests a more social and potentially churn-heavy environment than quieter peers.",official,The Highland official site and Zillow listing,https://www.thehighlandgk.com/,2026-04-05,inferred,mixed,"There is no clear furnished-stay or short-term language in the current source set, but the property branding is highly nightlife and rooftop oriented."
the-highland-1411-n-highland-ave--ev-6,building,the-highland-1411-n-highland-ave,amenities,"Current large-listing coverage corroborates strong resident features including rooftop lounge, detached garage, bike storage, on-site maintenance, and in-unit laundry.",review,Zillow and Apartments.com,https://www.apartments.com/the-highland-hollywood-ca/0pwyef2/,2026-04-05,corroborated,positive,"Zillow and Apartments.com both show in-unit washers and dryers, rooftop lounge space, bike storage, garage parking, and on-site maintenance."
vantage-hollywood-1710-n-fuller-ave--ev-1,building,vantage-hollywood-1710-n-fuller-ave,amenities,"Current official materials confirm a strong operating and amenity stack that includes access control, reserved parking, EV charging, Amazon Hub package lockers, on-site management, heated pools, and a 24-hour fitness center.",official,Equity Apartments property page,https://www.equityapartments.com/los-angeles/west-hollywood/vantage-apartments,2026-04-05,confirmed,positive,"The current Equity page lists access controlled community, reserved parking, on-site management, Amazon Hub package lockers, heated pools, EV charging stations, and a 24-hour fitness center."
vantage-hollywood-1710-n-fuller-ave--ev-2,building,vantage-hollywood-1710-n-fuller-ave,pricing_transparency,Current listing feeds show live studio and 1 bedroom inventory in the target band and explicitly warn that displayed pricing may exclude required fees and charges.,official,Zillow building page,https://www.zillow.com/apartments/los-angeles-ca/vantage-hollywood/5XkJ3S/,2026-04-05,confirmed,mixed,"Zillow currently shows studios from $1,845 and 1 bedrooms from $1,981, while also stating that price may not include required fees and charges."
